{
  "$defs": {
    "Bid": {
      "additionalProperties": true,
      "description": "Section 4.3.3",
      "properties": {
        "adid": {
          "type": "string"
        },
        "adm": {
          "type": "string"
        },
        "adomain": {
          "items": {
            "type": "string"
          },
          "type": "array"
        },
        "attr": {
          "type": "array"
        },
        "cid": {
          "type": "string"
        },
        "crid": {
          "type": "string"
        },
        "ext": {
          "type": "object"
        },
        "id": {
          "type": "string"
        },
        "impid": {
          "type": "string"
        },
        "iurl": {
          "type": "string"
        },
        "nurl": {
          "type": "string"
        },
        "price": {
          "type": "number"
        }
      },
      "required": [
        "id",
        "impid",
        "price"
      ],
      "type": "object"
    },
    "SeatBid": {
      "additionalProperties": true,
      "description": "Section 4.3.2",
      "properties": {
        "bid": {
          "items": {
            "$ref": "#/$defs/Bid"
          },
          "type": "array"
        },
        "group": {
          "type": "integer"
        },
        "seat": {
          "type": "string"
        }
      },
      "required": [
        "bid"
      ],
      "type": "object"
    }
  },
  "$id": "https://rtblint.org/schemas/openrtb-2.0-bid-response.schema.json",
  "$schema": "https://json-schema.org/draft/2020-12/schema",
  "additionalProperties": true,
  "description": "Generated by rtblint from the OpenRTB 2.0 object catalog (released 2012-01). Structure, types, required fields, and documented value sets only: deprecations, moved paths, and semantic rules are what the linter adds.",
  "properties": {
    "bidid": {
      "type": "string"
    },
    "cur": {
      "type": "string"
    },
    "customdata": {
      "type": "string"
    },
    "ext": {
      "type": "object"
    },
    "id": {
      "type": "string"
    },
    "seatbid": {
      "items": {
        "$ref": "#/$defs/SeatBid"
      },
      "type": "array"
    }
  },
  "required": [
    "id",
    "seatbid"
  ],
  "title": "OpenRTB bid response (2.0)",
  "type": "object"
}
