{
  "id": "req-2-1-video-001",
  "bidid": "resp-2-1-77121",
  "cur": "USD",
  "seatbid": [
    {
      "seat": "dsp-acme",
      "group": 0,
      "bid": [
        {
          "id": "bid-2-1-1",
          "impid": "imp-preroll-1",
          "price": 7.8,
          "adid": "cr-2-1-902",
          "nurl": "https://dsp.example.com/win?p=${AUCTION_PRICE}",
          "adm": "<VAST version=\"2.0\"><Ad id=\"cr-902\"><InLine><AdSystem>acme-dsp</AdSystem><AdTitle>Preroll</AdTitle><Impression><![CDATA[https://dsp.example.com/imp]]></Impression></InLine></Ad></VAST>",
          "adomain": ["advertiser.example"],
          "cid": "camp-2-1-12",
          "crid": "cr-2-1-902",
          "attr": [6]
        }
      ]
    }
  ]
}
